<?xml version="1.0" encoding="UTF-8"?>
<CompetencyFramework xmlns="http://ns.medbiq.org/competencyframework/v1/" xmlns:lom="http://ltsc.ieee.org/xsd/LOM" xmlns:xsi="http://www.w3.org/2001/XMLSchema-instance" xsi:schemaLocation="http://ns.medbiq.org/competencyframework/v1/ competencyframework.xsd">
	<lom:lom>
		<lom:general>
			<lom:identifier>
				<lom:catalog>URI</lom:catalog>
				<lom:entry>http://www.example.org/short_order_cook_epas_v1</lom:entry>
			</lom:identifier>
			<lom:title>
				<lom:string>Short Order Cook Entrustable Professional Activities</lom:string>
			</lom:title>
			<lom:description>
				<lom:string language="en">The Entrustable Professional Activities (EPAs) of a short order cook. Learners will be entrusted to perform these activities during their training.</lom:string>
			</lom:description>
		</lom:general>
		<lom:lifeCycle>
			<lom:version>
				<lom:string>1.0</lom:string>
			</lom:version>
			<lom:contribute>
				<lom:entity>BEGIN:VCARD\nFN:Center for Really Good CooksEND:VCARD</lom:entity>
				<lom:role>
					<lom:source>LOMv1.0</lom:source>
					<lom:value>publisher</lom:value>
				</lom:role>
			</lom:contribute>
		</lom:lifeCycle>
		<lom:rights>
			<lom:copyrightAndOtherRestrictions>
				<lom:source>LOMv1.0</lom:source>
				<lom:value>yes</lom:value>
			</lom:copyrightAndOtherRestrictions>
			<lom:description>
				<lom:string language="en">Creative Commons Attribution 3.0 Unported license, http://creativecommons.org/licenses/by/3.0/</lom:string>
			</lom:description>
		</lom:rights>
	</lom:lom>
	<Includes>
		<Catalog>URI</Catalog>
		<Entry>http://www.example.org/shortordercookepas/e1</Entry>
	</Includes>
	<Includes>
		<Catalog>URI</Catalog>
		<Entry>http://www.example.org/shortordercookepas/e2</Entry>
	</Includes>	
	<Includes>
		<Catalog>URI</Catalog>
		<Entry>http://www.example.org/shortordercookepas/e3</Entry>
	</Includes>
	<Relation>
		<Reference1>
			<Catalog>URI</Catalog>
			<Entry>http://www.example.org/shortordercookepas/e1</Entry>
		</Reference1>
		<Relationship>http://www.w3.org/2004/02/skos/core#related</Relationship>
		<Reference2>
			<Catalog>URI</Catalog>
			<Entry>http://www.example.org/shortordercookcompetencies/c1</Entry>
		</Reference2>
	</Relation>
	<Relation>
		<Reference1>
			<Catalog>URI</Catalog>
			<Entry>http://www.example.org/shortordercookepas/e1</Entry>
		</Reference1>
		<Relationship>http://www.w3.org/2004/02/skos/core#related</Relationship>
		<Reference2>
			<Catalog>URI</Catalog>
			<Entry>http://www.example.org/shortordercookcompetencies/c2</Entry>
		</Reference2>
	</Relation>
	<Relation>
		<Reference1>
			<Catalog>URI</Catalog>
			<Entry>http://www.example.org/shortordercookepas/e1</Entry>
		</Reference1>
		<Relationship>http://www.w3.org/2004/02/skos/core#related</Relationship>
		<Reference2>
			<Catalog>URI</Catalog>
			<Entry>http://www.example.org/shortordercookcompetencies/c3</Entry>
		</Reference2>
	</Relation>
	<Relation>
		<Reference1>
			<Catalog>URI</Catalog>
			<Entry>http://www.example.org/shortordercookepas/e1</Entry>
		</Reference1>
		<Relationship>http://www.w3.org/2004/02/skos/core#related</Relationship>
		<Reference2>
			<Catalog>URI</Catalog>
			<Entry>http://www.example.org/shortordercookcompetencies/c4</Entry>
		</Reference2>
	</Relation>
	<Relation>
		<Reference1>
			<Catalog>URI</Catalog>
			<Entry>http://www.example.org/shortordercookepas/e1</Entry>
		</Reference1>
		<Relationship>http://www.w3.org/2004/02/skos/core#related</Relationship>
		<Reference2>
			<Catalog>URI</Catalog>
			<Entry>http://www.example.org/shortordercookcompetencies/c5</Entry>
		</Reference2>
	</Relation>
	<Relation>
		<Reference1>
			<Catalog>URI</Catalog>
			<Entry>http://www.example.org/shortordercookepas/e1</Entry>
		</Reference1>
		<Relationship>http://www.w3.org/2004/02/skos/core#related</Relationship>
		<Reference2>
			<Catalog>URI</Catalog>
			<Entry>http://www.example.org/shortordercookcompetencies/c6c</Entry>
		</Reference2>
	</Relation>
	<Relation>
		<Reference1>
			<Catalog>URI</Catalog>
			<Entry>http://www.example.org/shortordercookepas/e1</Entry>
		</Reference1>
		<Relationship>http://www.w3.org/2004/02/skos/core#related</Relationship>
		<Reference2>
			<Catalog>URI</Catalog>
			<Entry>http://www.example.org/shortordercookcompetencies/c7a</Entry>
		</Reference2>
	</Relation>
	<Relation>
		<Reference1>
			<Catalog>URI</Catalog>
			<Entry>http://www.example.org/shortordercookepas/e2</Entry>
		</Reference1>
		<Relationship>http://www.w3.org/2004/02/skos/core#related</Relationship>
		<Reference2>
			<Catalog>URI</Catalog>
			<Entry>http://www.example.org/shortordercookcompetencies/c2b</Entry>
		</Reference2>
	</Relation>
	<Relation>
		<Reference1>
			<Catalog>URI</Catalog>
			<Entry>http://www.example.org/shortordercookepas/e2</Entry>
		</Reference1>
		<Relationship>http://www.w3.org/2004/02/skos/core#related</Relationship>
		<Reference2>
			<Catalog>URI</Catalog>
			<Entry>http://www.example.org/shortordercookcompetencies/c3</Entry>
		</Reference2>
	</Relation>
	<Relation>
		<Reference1>
			<Catalog>URI</Catalog>
			<Entry>http://www.example.org/shortordercookepas/e2</Entry>
		</Reference1>
		<Relationship>http://www.w3.org/2004/02/skos/core#related</Relationship>
		<Reference2>
			<Catalog>URI</Catalog>
			<Entry>http://www.example.org/shortordercookcompetencies/c4</Entry>
		</Reference2>
	</Relation>
	<Relation>
		<Reference1>
			<Catalog>URI</Catalog>
			<Entry>http://www.example.org/shortordercookepas/e2</Entry>
		</Reference1>
		<Relationship>http://www.w3.org/2004/02/skos/core#related</Relationship>
		<Reference2>
			<Catalog>URI</Catalog>
			<Entry>http://www.example.org/shortordercookcompetencies/c5</Entry>
		</Reference2>
	</Relation>
	<Relation>
		<Reference1>
			<Catalog>URI</Catalog>
			<Entry>http://www.example.org/shortordercookepas/e2</Entry>
		</Reference1>
		<Relationship>http://www.w3.org/2004/02/skos/core#related</Relationship>
		<Reference2>
			<Catalog>URI</Catalog>
			<Entry>http://www.example.org/shortordercookcompetencies/c6d</Entry>
		</Reference2>
	</Relation>
	<Relation>
		<Reference1>
			<Catalog>URI</Catalog>
			<Entry>http://www.example.org/shortordercookepas/e2</Entry>
		</Reference1>
		<Relationship>http://www.w3.org/2004/02/skos/core#related</Relationship>
		<Reference2>
			<Catalog>URI</Catalog>
			<Entry>http://www.example.org/shortordercookcompetencies/c7a</Entry>
		</Reference2>
	</Relation>
	<Relation>
		<Reference1>
			<Catalog>URI</Catalog>
			<Entry>http://www.example.org/shortordercookepas/e3</Entry>
		</Reference1>
		<Relationship>http://www.w3.org/2004/02/skos/core#related</Relationship>
		<Reference2>
			<Catalog>URI</Catalog>
			<Entry>http://www.example.org/shortordercookcompetencies/c6a</Entry>
		</Reference2>
	</Relation>
	<Relation>
		<Reference1>
			<Catalog>URI</Catalog>
			<Entry>http://www.example.org/shortordercookepas/e3</Entry>
		</Reference1>
		<Relationship>http://www.w3.org/2004/02/skos/core#related</Relationship>
		<Reference2>
			<Catalog>URI</Catalog>
			<Entry>http://www.example.org/shortordercookcompetencies/c6b</Entry>
		</Reference2>
	</Relation>
	<Relation>
		<Reference1>
			<Catalog>URI</Catalog>
			<Entry>http://www.example.org/shortordercookepas/e3</Entry>
		</Reference1>
		<Relationship>http://www.w3.org/2004/02/skos/core#related</Relationship>
		<Reference2>
			<Catalog>URI</Catalog>
			<Entry>http://www.example.org/shortordercookcompetencies/c6e</Entry>
		</Reference2>
	</Relation>
	<Relation>
		<Reference1>
			<Catalog>URI</Catalog>
			<Entry>http://www.example.org/shortordercookepas/e3</Entry>
		</Reference1>
		<Relationship>http://www.w3.org/2004/02/skos/core#related</Relationship>
		<Reference2>
			<Catalog>URI</Catalog>
			<Entry>http://www.example.org/shortordercookcompetencies/c7b</Entry>
		</Reference2>
	</Relation>
</CompetencyFramework>
